{
  "$schema": "https://json-schema.org/draft/2020-12/schema",
  "$id": "https://intent-os.local/benchmarks/schemas/system-benchmark-run.schema.json",
  "title": "Intent OS System Routing Benchmark Run",
  "type": "object",
  "additionalProperties": false,
  "required": [
    "benchmark_id",
    "run_id",
    "started_at",
    "finished_at",
    "case_suite_version",
    "router_version",
    "router_config_hash",
    "fixed_default_resource_id",
    "randomization_seed",
    "operator_expertise",
    "resource_pool_snapshot",
    "judge_configuration",
    "evaluation_cost_usd",
    "trials"
  ],
  "properties": {
    "benchmark_id": {"const": "system-routing-v0.1"},
    "run_id": {"type": "string", "minLength": 1},
    "started_at": {"type": "string", "format": "date-time"},
    "finished_at": {"type": "string", "format": "date-time"},
    "case_suite_version": {"type": "string", "minLength": 1},
    "router_version": {"type": "string", "minLength": 1},
    "router_config_hash": {"type": "string", "minLength": 1},
    "fixed_default_resource_id": {"type": "string", "minLength": 1},
    "randomization_seed": {"type": "integer", "minimum": 0},
    "operator_expertise": {"enum": ["novice", "intermediate", "expert"]},
    "resource_pool_snapshot": {
      "type": "array",
      "minItems": 1,
      "items": {
        "type": "object",
        "additionalProperties": false,
        "required": ["resource_id", "kind", "provider", "version"],
        "properties": {
          "resource_id": {"type": "string", "minLength": 1},
          "kind": {"enum": ["model", "tool", "human", "service"]},
          "provider": {"type": "string", "minLength": 1},
          "version": {"type": "string", "minLength": 1},
          "pricing_snapshot": {"type": ["object", "null"], "additionalProperties": true},
          "capabilities": {"type": "array", "items": {"type": "string"}}
        }
      }
    },
    "judge_configuration": {
      "type": "object",
      "additionalProperties": false,
      "required": ["blind", "judge_ids", "human_tiebreak_threshold"],
      "properties": {
        "blind": {"const": true},
        "judge_ids": {"type": "array", "minItems": 1, "items": {"type": "string", "minLength": 1}},
        "human_tiebreak_threshold": {"type": "number", "minimum": 0, "maximum": 100},
        "notes": {"type": "string"}
      }
    },
    "evaluation_cost_usd": {"type": "number", "minimum": 0},
    "notes": {"type": "string"},
    "trials": {
      "type": "array",
      "minItems": 1,
      "items": {
        "type": "object",
        "additionalProperties": false,
        "required": [
          "trial_id",
          "case_id",
          "repetition",
          "arm",
          "status",
          "selected_resource_ids",
          "selection_time_ms",
          "router_overhead_ms",
          "execution_latency_ms",
          "total_cost_usd",
          "rework_count",
          "internal_retry_count",
          "accepted",
          "excluded"
        ],
        "properties": {
          "trial_id": {"type": "string", "minLength": 1},
          "case_id": {"type": "string", "pattern": "^[WRPSCT][0-9]{2}$"},
          "repetition": {"type": "integer", "minimum": 1},
          "arm": {"enum": ["manual", "fixed", "intent_os"]},
          "status": {
            "enum": [
              "completed",
              "timeout",
              "provider_error",
              "tool_error",
              "policy_block",
              "invalid_output",
              "budget_exceeded",
              "user_abandoned"
            ]
          },
          "selected_resource_ids": {"type": "array", "items": {"type": "string", "minLength": 1}},
          "decision_id": {"type": ["string", "null"]},
          "selection_time_ms": {"type": "number", "minimum": 0},
          "router_overhead_ms": {"type": "number", "minimum": 0},
          "execution_latency_ms": {"type": "number", "minimum": 0},
          "time_to_accepted_ms": {"type": ["number", "null"], "minimum": 0},
          "total_cost_usd": {"type": "number", "minimum": 0},
          "rework_count": {"type": "integer", "minimum": 0, "maximum": 2},
          "internal_retry_count": {"type": "integer", "minimum": 0},
          "quality_score": {"type": ["number", "null"], "minimum": 0, "maximum": 100},
          "satisfaction_1_7": {"type": ["number", "null"], "minimum": 1, "maximum": 7},
          "accepted": {"type": "boolean"},
          "excluded": {"type": "boolean"},
          "excluded_reason": {"type": ["string", "null"]},
          "output_artifact_ref": {"type": ["string", "null"]},
          "freshness_snapshot_ref": {"type": ["string", "null"]}
        }
      }
    }
  }
}