{
  "benchmark_id": "system-routing-v0.1",
  "run_id": "example-not-a-real-result",
  "started_at": "2026-08-07T10:00:00Z",
  "finished_at": "2026-08-07T10:05:00Z",
  "case_suite_version": "0.1",
  "router_version": "router-example",
  "router_config_hash": "example-config-hash",
  "fixed_default_resource_id": "model-balanced",
  "randomization_seed": 42,
  "operator_expertise": "intermediate",
  "resource_pool_snapshot": [
    {
      "resource_id": "model-fast",
      "kind": "model",
      "provider": "example",
      "version": "1",
      "pricing_snapshot": {"unit": "example"},
      "capabilities": ["writing"]
    },
    {
      "resource_id": "model-balanced",
      "kind": "model",
      "provider": "example",
      "version": "1",
      "pricing_snapshot": {"unit": "example"},
      "capabilities": ["writing", "reasoning"]
    },
    {
      "resource_id": "model-reasoning",
      "kind": "model",
      "provider": "example",
      "version": "1",
      "pricing_snapshot": {"unit": "example"},
      "capabilities": ["reasoning"]
    }
  ],
  "judge_configuration": {
    "blind": true,
    "judge_ids": ["judge-a", "judge-b"],
    "human_tiebreak_threshold": 15
  },
  "evaluation_cost_usd": 0.01,
  "notes": "Schema and scorer example only. These are synthetic values, not benchmark evidence.",
  "trials": [
    {
      "trial_id": "W01-manual-1",
      "case_id": "W01",
      "repetition": 1,
      "arm": "manual",
      "status": "completed",
      "selected_resource_ids": ["model-balanced"],
      "decision_id": null,
      "selection_time_ms": 12000,
      "router_overhead_ms": 0,
      "execution_latency_ms": 4200,
      "time_to_accepted_ms": 17000,
      "total_cost_usd": 0.02,
      "rework_count": 1,
      "internal_retry_count": 0,
      "quality_score": 82,
      "satisfaction_1_7": 5.5,
      "accepted": true,
      "excluded": false,
      "excluded_reason": null,
      "output_artifact_ref": null,
      "freshness_snapshot_ref": null
    },
    {
      "trial_id": "W01-fixed-1",
      "case_id": "W01",
      "repetition": 1,
      "arm": "fixed",
      "status": "completed",
      "selected_resource_ids": ["model-balanced"],
      "decision_id": null,
      "selection_time_ms": 0,
      "router_overhead_ms": 0,
      "execution_latency_ms": 4000,
      "time_to_accepted_ms": 18000,
      "total_cost_usd": 0.02,
      "rework_count": 1,
      "internal_retry_count": 0,
      "quality_score": 78,
      "satisfaction_1_7": 5,
      "accepted": true,
      "excluded": false,
      "excluded_reason": null,
      "output_artifact_ref": null,
      "freshness_snapshot_ref": null
    },
    {
      "trial_id": "W01-intent_os-1",
      "case_id": "W01",
      "repetition": 1,
      "arm": "intent_os",
      "status": "completed",
      "selected_resource_ids": ["model-reasoning"],
      "decision_id": "dec-example",
      "selection_time_ms": 0,
      "router_overhead_ms": 180,
      "execution_latency_ms": 4600,
      "time_to_accepted_ms": 14000,
      "total_cost_usd": 0.022,
      "rework_count": 0,
      "internal_retry_count": 0,
      "quality_score": 86,
      "satisfaction_1_7": 6,
      "accepted": true,
      "excluded": false,
      "excluded_reason": null,
      "output_artifact_ref": null,
      "freshness_snapshot_ref": null
    }
  ]
}